{
  "schema_version": "1.0.0",
  "course_id": "project_in_mathematics_real_check",
  "pool_status": "starter",
  "source_file": "materials/processed/assessment/problem-pool-starter.md",
  "generated_at": "2026-04-21T11:42:41.276Z",
  "items": [
    {
      "problem_id": "proj-scope-feasibility-01",
      "module_id": "project-scoping-and-advisor-alignment",
      "clo_id": "CLO1",
      "bloom_level": "analyze",
      "problem_type": "diagnosis",
      "statement": "Review a proposed mathematics project topic and decide whether the scope is feasible for one semester. Explain the main reason for your decision.",
      "target_skill": "scope a project realistically and justify the judgment",
      "misconception_tags": [
        "too-broad-scope",
        "no-math-focus",
        "ignores-time-constraint"
      ],
      "usable_for": [
        "active-learning",
        "mission"
      ],
      "difficulty": "medium",
      "solution_status": "not_started",
      "solution_required": true,
      "expected_answer_form": "numeric-or-expression",
      "needs_solution_review": true,
      "source": "TQF3 + advisor workflow",
      "notes": "good candidate for early mission framing later",
      "review_status": "pending"
    },
    {
      "problem_id": "lit-review-source-quality-01",
      "module_id": "literature-review-and-project-planning",
      "clo_id": "CLO2",
      "bloom_level": "analyze",
      "problem_type": "classification",
      "statement": "Sort four candidate references into strong and weak starting sources for a mathematics project.",
      "target_skill": "evaluate source quality for literature review planning",
      "misconception_tags": [
        "source-counts-as-quality",
        "web-page-equals-paper"
      ],
      "usable_for": [
        "quick-check",
        "mission",
        "sbra"
      ],
      "difficulty": "medium",
      "solution_status": "not_started",
      "solution_required": true,
      "expected_answer_form": "numeric-or-expression",
      "needs_solution_review": true,
      "source": "TQF3 + course-design framing",
      "notes": "needs distractor notes in a later round",
      "review_status": "pending"
    },
    {
      "problem_id": "progress-review-risk-01",
      "module_id": "project-execution-and-progress-review",
      "clo_id": "CLO3",
      "bloom_level": "evaluate",
      "problem_type": "reflection",
      "statement": "Examine a short progress log and identify the most important project risk that should be raised in the next advisor meeting.",
      "target_skill": "monitor progress and identify real project risk",
      "misconception_tags": [
        "progress-without-evidence",
        "activity-equals-progress"
      ],
      "usable_for": [
        "active-learning",
        "mission"
      ],
      "difficulty": "medium",
      "solution_status": "not_started",
      "solution_required": true,
      "expected_answer_form": "numeric-or-expression",
      "needs_solution_review": true,
      "source": "TQF3 + project milestone notes",
      "notes": "could later split into process and reasoning steps",
      "review_status": "pending"
    },
    {
      "problem_id": "seminar-claim-evidence-01",
      "module_id": "report-writing-and-seminar-presentation",
      "clo_id": "CLO5",
      "bloom_level": "create",
      "problem_type": "proof-repair",
      "statement": "Repair a weak seminar claim by adding the missing mathematical evidence or clarification needed for a defensible presentation.",
      "target_skill": "strengthen mathematical communication with evidence",
      "misconception_tags": [
        "claim-without-support",
        "presentation-over-substance"
      ],
      "usable_for": [
        "mission",
        "sbra"
      ],
      "difficulty": "hard",
      "solution_status": "not_started",
      "solution_required": true,
      "expected_answer_form": "numeric-or-expression",
      "needs_solution_review": true,
      "source": "TQF3 + seminar expectations",
      "notes": "likely good for a later proof-oriented mission family",
      "review_status": "pending"
    }
  ]
}
